{
  "$schema": "https://json-schema.org/draft/2020-12/schema",
  "title": "A course pack's choose-tool puzzle (courses/<id>/puzzles/<name>.json)",
  "description": "Pick the tool (or mode) that fits the job: the right one does it, a wrong one gets its reason. For first-words: the speaking tube or the hatch; for the Three Helms (Copilot app only): the session mode for each order. Every puzzle file has an `id`, its `mechanic`, and may set `disabled` (the site stays as scenery), `text` (its words by key, `{name}` filled in by the game) and `lines` (its voice line ids by what they're for). docs/specs/COURSE-PACKS.md §4.",
  "type": "object",
  "additionalProperties": false,
  "required": ["id", "mechanic"],
  "properties": {
    "$schema": {
      "type": "string"
    },
    "$comment": {
      "type": "string"
    },
    "id": {
      "type": "string",
      "minLength": 1
    },
    "mechanic": {
      "const": "choose-tool"
    },
    "quest": {
      "type": "string",
      "pattern": "^[A-Za-z0-9][\\w.:-]*$",
      "description": "The quest the puzzle plays in (a quest of this course): the steps its mechanic sets and waits on (PUZZLE_STEPS, src/course/puzzles.ts) are that quest's."
    },
    "steps": {
      "type": "object",
      "description": "The mechanic's steps (PUZZLE_STEPS) that the quest calls something else: game step → the quest's step.",
      "additionalProperties": {
        "type": "string",
        "minLength": 1
      }
    },
    "disabled": {
      "type": "boolean",
      "description": "The course turns this puzzle off: its site stays as scenery and its cue does nothing."
    },
    "text": {
      "type": "object",
      "description": "The puzzle's words by key (labels, hints, readouts, signs).",
      "additionalProperties": {
        "type": "string"
      }
    },
    "lines": {
      "type": "object",
      "description": "Voice line ids (voice/lines.json) by what they're for.",
      "additionalProperties": {
        "type": "string",
        "pattern": "^[\\w.-]+$"
      }
    },
    "quiz": {
      "type": "string",
      "description": "The quiz it asks first, if any."
    },
    "tools": {
      "type": "object",
      "minProperties": 2
    },
    "prompt": {
      "type": "string",
      "minLength": 1
    },
    "hatch": {
      "type": "object"
    },
    "reply": {
      "type": "object"
    },
    "scripts": {
      "type": "object",
      "description": "Script steps it plays, by name (as in quests/<island>.json).",
      "additionalProperties": {
        "type": "array",
        "items": {
          "type": "object",
          "minProperties": 1
        },
        "minItems": 1
      }
    },
    "modes": {
      "type": "object",
      "minProperties": 2,
      "additionalProperties": {
        "type": "object",
        "additionalProperties": false,
        "required": ["acts", "name", "says"],
        "properties": {
          "acts": {
            "description": "The Three Helms: the game's helm this mode acts out (steer: you choose each leg; review: a chart to accept, take over or amend; auto: handed over end to end). Each helm is bound once.",
            "enum": ["steer", "review", "auto"]
          },
          "name": {
            "type": "string",
            "minLength": 1
          },
          "says": {
            "type": "string",
            "minLength": 1
          }
        }
      },
      "description": "The Three Helms: the course's modes, keyed by its own ids (orders, their `wrong` and orderHints use the same keys)."
    },
    "orders": {
      "type": "object",
      "minProperties": 1
    },
    "review": {
      "type": "array",
      "items": {
        "type": "object",
        "additionalProperties": false,
        "required": ["id", "acts", "label"],
        "properties": {
          "id": {
            "type": "string",
            "pattern": "^[a-z][\\w-]*$"
          },
          "acts": {
            "description": "What the option does: accept (sail the chart), takeOver (hand the wheel back), amend (chart round the Shoal). Each once.",
            "enum": ["accept", "takeOver", "amend"]
          },
          "label": {
            "type": "string",
            "minLength": 1
          }
        }
      }
    },
    "orderHints": {
      "type": "object",
      "additionalProperties": {
        "type": "string",
        "minLength": 1
      }
    }
  },
  "$defs": {
    "text": {
      "type": "string",
      "minLength": 1
    }
  }
}
